{
  "schema_version": "2.0.0",
  "suggestion_id": "018f1e2d-3c4b-7a05-8c9d-001122334459",
  "session_id": "018f1e2d-3c4b-7a02-8c9d-001122334456",
  "tenant_id": "018f1e2d-3c4b-7a01-8c9d-001122334455",
  "source_agent_type": "deliberative_lane",
  "suggestion_type": "next_question",
  "content": "Pergunte qual prazo de implantação é necessário.",
  "confidence": 0.84,
  "evidence_refs": [
    "role_state:missing_fields"
  ],
  "priority": 55,
  "created_at": "2026-07-14T20:00:00Z",
  "expires_at": "2026-07-14T21:00:00Z"
}
